{
  "$schema": "https://json-schema.org/draft/2020-12/schema",
  "type": "object",
  "required": [
    "title",
    "product_url",
    "price_text",
    "availability_text",
    "rating_text",
    "description",
    "source_page",
    "fetched_at",
    "price_gbp"
  ],
  "additionalProperties": false,
  "properties": {
    "title": { "type": "string" },
    "product_url": { "type": "string", "format": "uri", "pattern": "^https://" },
    "price_text": { "type": "string" },
    "availability_text": { "type": "string" },
    "rating_text": { "type": "string" },
    "description": { "type": ["string", "null"] },
    "source_page": { "type": "string", "format": "uri", "pattern": "^https://" },
    "fetched_at": { "type": "string", "format": "date-time", "pattern": "^\\d{4}-\\d{2}-\\d{2}T\\d{2}:\\d{2}:\\d{2}Z$" },
    "price_gbp": { "type": "number" }
  }
}
